{
  "$schema": "https://json-schema.org/draft/2020-12/schema",
  "$id": "https://navide.dev/schemas/plugin-manifest-v2.schema.json",
  "title": "Navide Plugin Manifest v2 (draft)",
  "type": "object",
  "additionalProperties": false,
  "required": ["schemaVersion", "apiVersion", "id", "name", "version", "publisher", "permissions", "marketplace"],
  "properties": {
    "schemaVersion": { "const": 2 },
    "apiVersion": { "type": "string", "pattern": "^[~^]?[0-9]+\\.[0-9]+\\.[0-9]+$" },
    "id": { "type": "string", "pattern": "^[a-z0-9][a-z0-9-]*(\\.[a-z0-9][a-z0-9-]*)+$" },
    "name": { "type": "string", "minLength": 1, "maxLength": 80, "pattern": "^[^\\r\\n<>]+$" },
    "version": { "type": "string", "pattern": "^(0|[1-9][0-9]*)\\.(0|[1-9][0-9]*)\\.(0|[1-9][0-9]*)(?:-((?:0|[1-9][0-9]*|[0-9A-Za-z-]*[A-Za-z-][0-9A-Za-z-]*)(?:\\.(?:0|[1-9][0-9]*|[0-9A-Za-z-]*[A-Za-z-][0-9A-Za-z-]*))*))?(?:\\+[0-9A-Za-z-]+(?:\\.[0-9A-Za-z-]+)*)?$" },
    "publisher": { "type": "string", "pattern": "^[a-z0-9][a-z0-9-]*$" },
    "engines": {
      "type": "object",
      "additionalProperties": false,
      "required": ["navide"],
      "properties": { "navide": { "type": "string", "minLength": 1 } }
    },
    "permissions": {
      "type": "object",
      "additionalProperties": false,
      "properties": {
        "fs": {
          "type": "array",
          "minItems": 1,
          "maxItems": 1,
          "uniqueItems": true,
          "items": { "const": "read" }
        },
        "ui": {
          "type": "array",
          "minItems": 1,
          "uniqueItems": true,
          "items": { "enum": ["openInEditor", "openExternal"] }
        }
      }
    },
    "marketplace": { "$ref": "#/$defs/marketplace" },
    "contributes": {
      "type": "object",
      "additionalProperties": false,
      "required": ["views"],
      "properties": {
        "views": {
          "type": "array",
          "minItems": 1,
          "maxItems": 16,
          "items": { "$ref": "#/$defs/view" }
        }
      }
    },
    "backend": { "$ref": "#/$defs/backend" }
  },
  "anyOf": [
    { "required": ["contributes"] },
    { "required": ["backend"] }
  ],
  "$defs": {
    "marketplace": {
      "type": "object",
      "additionalProperties": false,
      "required": ["description", "license"],
      "properties": {
        "description": {
          "type": "string",
          "minLength": 1,
          "maxLength": 280,
          "pattern": "^[^\\r\\n<>]+$"
        },
        "license": {
          "type": "string",
          "minLength": 1,
          "maxLength": 100,
          "pattern": "^[A-Za-z0-9][A-Za-z0-9.()+ -]*$"
        },
        "repository": { "$ref": "#/$defs/httpsUri" },
        "homepage": { "$ref": "#/$defs/httpsUri" },
        "categories": {
          "type": "array",
          "maxItems": 5,
          "uniqueItems": true,
          "items": { "type": "string", "pattern": "^[a-z0-9][a-z0-9-]{0,39}$" }
        },
        "icon": { "$ref": "#/$defs/safePath" }
      }
    },
    "view": {
      "type": "object",
      "additionalProperties": false,
      "required": ["id", "kind", "location", "title", "entry"],
      "properties": {
        "id": { "type": "string", "pattern": "^[a-z][a-z0-9-]*$" },
        "kind": { "const": "custom" },
        "location": { "enum": ["top", "bottom", "right", "left", "main", "window"] },
        "title": { "type": "string", "minLength": 1, "maxLength": 80, "pattern": "^[^\\r\\n<>]+$" },
        "icon": { "$ref": "#/$defs/safePath" },
        "entry": { "$ref": "#/$defs/htmlPath" }
      }
    },
    "backend": {
      "type": "object",
      "additionalProperties": false,
      "required": ["entry", "protocolVersion", "activation"],
      "properties": {
        "entry": { "$ref": "#/$defs/backendEntry" },
        "protocolVersion": {
          "const": 1,
          "description": "Navide Backend Wire v1, aligned with MCP revision 2026-07-28 base message and stdio conventions."
        },
        "activation": { "const": "startup" }
      }
    },
    "safePath": {
      "type": "string",
      "minLength": 1,
      "pattern": "^(?!/)(?!.*//)(?!.*(?:^|/)\\.(?:/|$))(?!.*(?:^|/)\\.\\.(?:/|$))(?!.*\\\\)(?!.*\\/$)[A-Za-z0-9._/-]+$"
    },
    "backendEntry": {
      "description": "Manifest-level rejection of recognizable source/script filenames. Target executable verification belongs to package validation.",
      "allOf": [
        { "$ref": "#/$defs/safePath" },
        {
          "pattern": "^(?!.*\\.(?:[Pp][Yy][Ww]?|[Jj][Ss]|[Mm][Jj][Ss]|[Cc][Jj][Ss]|[Tt][Ss]|[Tt][Ss][Xx]|[Ss][Hh]|[Bb][Aa][Ss][Hh]|[Zz][Ss][Hh]|[Ff][Ii][Ss][Hh]|[Pp][Ss]1|[Cc][Mm][Dd]|[Bb][Aa][Tt])$).+$"
        }
      ]
    },
    "htmlPath": {
      "type": "string",
      "pattern": "^(?!/)(?!.*//)(?!.*(?:^|/)\\.(?:/|$))(?!.*(?:^|/)\\.\\.(?:/|$))(?!.*\\\\)[A-Za-z0-9._/-]+\\.html$"
    },
    "httpsUri": {
      "type": "string",
      "maxLength": 2048,
      "pattern": "^https://[^\\s]+$"
    }
  }
}
