{
  "schemaVersion": 2,
  "apiVersion": "^1.0.0",
  "id": "acme.build-metadata",
  "name": "Build Metadata",
  "version": "1.2.3-0.3.7+build.4",
  "publisher": "acme",
  "permissions": {},
  "marketplace": { "description": "A build metadata view.", "license": "MIT" },
  "contributes": {
    "views": [
      {
        "id": "main",
        "kind": "custom",
        "location": "main",
        "title": "Main",
        "entry": "frontend/main/index.html"
      }
    ]
  }
}
