{
  "schemaVersion": 2,
  "apiVersion": "^1.0.0",
  "id": "acme.prerelease",
  "name": "Prerelease",
  "version": "1.2.3-alpha.1",
  "publisher": "acme",
  "permissions": {},
  "marketplace": { "description": "A prerelease view.", "license": "MIT" },
  "contributes": {
    "views": [
      {
        "id": "main",
        "kind": "custom",
        "location": "main",
        "title": "Main",
        "entry": "frontend/main/index.html"
      }
    ]
  }
}
