{
  "schemaVersion": 2,
  "apiVersion": "^1.0.0",
  "id": "acme.files",
  "name": "Files",
  "version": "1.0.0",
  "publisher": "acme",
  "permissions": {},
  "marketplace": {
    "description": "Browse workspace files and maintain an index.",
    "license": "MIT"
  },
  "contributes": {
    "views": [
      {
        "id": "left",
        "kind": "custom",
        "location": "left",
        "title": "Files",
        "entry": "frontend/left/index.html"
      }
    ]
  },
  "backend": {
    "entry": "backend/acme-files",
    "protocolVersion": 1,
    "activation": "startup"
  }
}
